,StTime,line,token,type
269,2890.3576,where people are being killed every day., are ,CO2
270,2898.5946,realize that these are real people that we're talking about, are ,CO2
271,2921.7611,And it's like you- you're pushing people back into that life because people don't know in Virginia there are still prostitutes walking around in DC., are ,CO2
272,3143.0477,and people are amazed, are ,CO2
273,3227.9197,My dad is outside! You may know him., is ,CO2
274,3304.2690,[So] my father is a alcoholic., is ,CO2
275,3316.0359,"And he- he honestly is a alcoholic. Um,", is ,CO2
276,3327.0893,and it's cause him and my mother are having problems., are ,CO2
277,3452.4878,"my favorite book again, is the Series of Unfortunate [Events],", is ,CO2
278,3473.0430,Always. And I still am to this day. Like I- I helped take care of he- his two children that he, am ,CO2
279,3488.6323,"things, [so Law and] Order SVU is probably my favorite TV [show.]", is ,CO2
280,3538.1162,"you have those incidents where those children are hurting themselves,", are ,CO2
281,3601.6320,CCB is probably, is ,CO2
282,3682.8622,Anthem or something like that. I can't remember what the name of the song is that Mumbo Sauce sings., is ,CO2
283,3695.9813,"Told her- I said, you don't what mumbo sauce- You don't know what fried chicken is til you go to DC.", is ,CO2
284,3704.7931,"street is that? Um,", is ,CO2
